video_id,trending_date,title,channel_title,category_id,publish_time,tags,views,likes,dislikes,comment_count,thumbnail_link,comments_disabled,ratings_disabled,video_error_or_removed,description
fe77K74czdA,17.14.11,STRANGER THINGS THEME trifft auf WEST COAST VIBEZ | ► BEAT MAKING - BOF #13 || ONEDAH,ONEDAH - The Hitwonder | Beats on Fleek,24,2017-11-12T15:12:04.000Z,stranger things theme|"west coast beat"|"beat making"|"beats on fleek"|"onedah"|"stranger things beat"|"making a beat"|"stranger things remix"|"beat making fl studio"|"rap beat 2018"|"hip hop beat 2018"|"stranger things theme remix"|"making a stranger things beat"|"making a beat fl studio"|"making a beat from scratsch"|"Hiphop.de",31016,819,21,61,https://i.ytimg.com/vi/fe77K74czdA/default.jpg,FALSE,FALSE,FALSE,"Freunde, ich präsentiere euch meine Making a Beat Serie Beats On Fleek. In dieser Folge zeige ich euch wie ich aus dem Stranger Things Theme Song einen West Coast Beat in FL Studio baue. Gebt dem Video nen Daumen hoch und hinterlasst feedback, wenns euch gefällt. � Für mehr Beat Making Videos abonniert meinen Kanal! Lasst uns die 10K knacken Freunde! Viel Spaß mit dem Video ✌️\n➡️ ABONNIEREN: https://goo.gl/RgCE1R ⬅️\n\nAlle Beats die ich produziere entstehen in FL Studio. Ein Beatprogramm was ich schon seit Tag 1 nutze. Mein Stil ist sehr stark geprägt von Producern wie Ryan Leslie, Timbaland, DJ Premier und Scott Storch. Ob Trap Beats oder Hip Hop Beats. Ich versuche dabei so vielfältig und kreativ wie möglich zu sein um mich von der Masse abzuheben. Das heisst, auch wenn ich mal mit dem Trend gehe, versuche ich dennoch in jede Beat Produktion meinen eigenen Stil mit einfließen zu lassen.\n\n� Beat Store | http://onedah.com\n� Abonniert | http://bit.ly/1lqPoc4\n� Offers & Discounts | http://eepurl.com/byDt2L\n� Free Beats Download | https://soundcloud.com/onedahmusic/3-free-beats-by-onedah-buy-free-download-hip-hop-rb-trap\n\n� Facebook | https://www.facebook.com/onedahmusic\n� Twitter | https://twitter.com/OnedahHitwonder\n☁️ Soundcloud | https://soundcloud.com/onedahmusic\n� Instagram | http://instagram.com/onedah\n� Snapchat | @onedahhitwonder\n� Email | info@onedah.com\n\n--------------------------------\n� Songs �\n--------------------------------\n► Feature Songs:\nJ. WHITE Feat. ONEDAH - Hannah Montana\nItunes: http://apple.co/2zTzZJ3\n\n► Produzierte Songs:\nNanik - Ich mach mein Ding\nhttp://apple.co/2yXmpFl\n\nNanik - Ünal (Album)\nAuf die Maafakka (Prod. by Onedah)\nShit Boy (Prod. by Onedah)\nhttp://amzn.to/2gVqXaA\n\n--------------------------------\n� Beat Playlists �\n--------------------------------\nR&B Instrumental Beats \n➡️ https://www.youtube.com/playlist?list=PLm7JRA2wNgBUulg3cvbDhEnxlvSrDMPW8\n\nHip Hop Instrumental Beats \n➡️ https://www.youtube.com/playlist?list=PLm7JRA2wNgBW3oxgwmKCr6HitcfYYTy6t\n\nTrap Instrumental Beats \n➡️ https://www.youtube.com/playlist?list=PLm7JRA2wNgBUSrpN2fZk9bGKR7CLRCphK\n\nBeat Making Videos \n➡️ https://www.youtube.com/playlist?list=PLm7JRA2wNgBVtKJ49YMMd0phcM3lTM7dc\n\n--------------------------------\nEnglish Description:\n--------------------------------\nWelcome to the official Youtube channel of ONEDAH - The Hitwonder. If you're looking for more type beats like this SUBSCRIBE NOW! You Got The Lyrics! I Got The Hits! I provide Artists with the hottest and unique beats. Best Type Beats for Best Prices. Onedah.com is your #1 source for the most unique Rap, R&B, Hip Hop & Trap beats on the net. New Beat Making Videos every Week!\n\nI proudly presents my Brand New Beat Making Series Beats on Fleek. I will be making hip hop beats, rap beats, trap beats and many more throughout these episodes. So enjoy and make sure to drop a comment of what you think & Please LIKE / Subscribe!� \n\nYou will find everything about making a beat from scratsch, stranger things theme, how to make beats, beat making in fl studio and making a trap beat on this Channel.\n\nSTRANGER THINGS THEME trifft auf WEST COAST VIBEZ | ► BEAT MAKING - BOF #13 || ONEDAH\nhttps://youtu.be/fe77K74czdA"
ypdHIAAR1aw,17.14.11,Fußballchallenge GEGEN MEINE FREUNDIN (+Arschbolzen),GoalKEEPERz,17,2017-11-12T12:00:06.000Z,GoalKEEPERz|"Goalkeeper"|"Torwart"|"Torspieler"|"fußballchallenge vs freundin"|"fußbll challenge"|"challenge mit freundin",167162,15451,423,617,https://i.ytimg.com/vi/ypdHIAAR1aw/default.jpg,FALSE,FALSE,FALSE,❤Kostenlos Abonnieren► https://goo.gl/udo6Z7\n❤FUßBALL LIFESTYLE KLAMOTTEN► http://www.gkzclothing.de\n❤DIE BESTEN HANDSCHUHE► http://ks.zone/e2/p659\n\n�Zu MissGKZ\n►https://www.instagram.com/missgkz/\n\n❤Die beste Torwartausrüstung\nKS Handschuhe►https://ks.zone/e2/p6590\nADIDAS SET►https://ks.zone/e2/Set-A16\nUNDERWEAR►https://ks.zone/e2/s1519\nKS Klamotten►https://ks.zone/e2/p6594\n\n�Mein Social Media\n✘INSTAGRAM► gkzkarol\n✘SNAPCHAT► gkzkarol\n✘FACEBOOK► gkzkarol\n✘TWITTER► gkz_karol\n\n�Wichtige Playlisten \n✘Was sind die besten Handschuhe►https://goo.gl/ynCpgB\n✘Werde ein besserer Torwart►https://goo.gl/O2w7xS\n✘VLOGS►https://goo.gl/3krSEp\n✘Challenges► https://goo.gl/FtgRS6\n✘KEEPERBATTLE's► https://goo.gl/AnuxF7
SFjU8cQQlnY,17.14.11,SA4 - NEUE DEUTSCHE QUELLE (LTD. Boxset) UNBOXING,AdlerssonReview,10,2017-11-12T19:49:15.000Z,maxhifikanal|"maxherzberg"|"review"|"AdlerssonPictures"|"unboxing"|"sa4"|"bombay sa4"|"187"|"strassenbande"|"maxwell"|"lx"|"gzuz"|"bonez mc"|"faruk111er"|"kuku"|"azad"|"capital bra"|"gringo"|"44"|"zuna"|"kmn"|"azet"|"nash"|"miami yacine"|"kollegah"|"farid bang"|"jbg 3"|"hype"|"mois"|"bonus"|"ep"|"boxhandschuhe"|"pusher"|"tasche"|"ott"|"haze",92278,4527,147,495,https://i.ytimg.com/vi/SFjU8cQQlnY/default.jpg,FALSE,FALSE,FALSE,"BOX *► http://amzn.to/2jkJ6zu\nMP3 *► http://amzn.to/2zBtLAG\nMESSER *► http://amzn.to/2huO10p\n\nAdlerssonPictures ► https://www.youtube.com/c/adlerssonpictures\n\nMerch / Fanshop ► https://www.seedshirt.de/shop/adlerssonpictures\n\ngrundlos Spenden ► https://www.paypal.me/AdlerssonPictures\n\nGünstig neue Spiele online kaufen *► http://mmo.ga/sx3W\n\nSocial Networks: \n \nFacebook ► https://www.facebook.com/adlerssonpictures\nInstagram ► http://instagram.com/adlerssonpictures\nTwitter ► https://twitter.com/MaxAdlersson\n\nAdresse für Fanpost: \nMax Herzberg\nPostnummer: 901138041\nPackstation 108\nFriedrich-List-Platz 2, 01069 Dresden\n\n'Werbelinks & Empfehlungen' bzw mein Epuipment \n\nHandy *► http://amzn.to/2z58UmW\nMaus *► http://amzn.to/2zceXZd\nNotebook *► http://amzn.to/2ilSiiW\nKamera *► http://amzn.to/2hw7Jph\nSmartwatch *► http://amzn.to/2z48r4p\nPC Lautsprecher *► http://amzn.to/2iT3qHQ\nBeleuchtung *► http://amzn.to/2zag4IM\nMikrofon *► http://amzn.to/2iTWNVZ\nAmazon Alexa *► http://amzn.to/2hvEtPl\nBluetooth Lautsprecher *► http://amzn.to/2zdt7t7\n\n*►= Affiliate Link\nDatenschutzerklärung wegen der Verwendung von Werbemitteln aus dem Amazon-Partnerprogramm:\nWir sind Teilnehmer des Partnerprogramms von Amazon EU, das zur Bereitstellung eines Mediums für Websites konzipiert wurde, mittels dessen durch die Platzierung von Werbeanzeigen und Links zu Amazon.de Werbekostenerstattung verdient werden kann. Zur Nachverfolgung der Bestellung setzt Amazon Cookies ein, die es ermöglichen, zu erkennen, dass Sie auf unserer Seite einen Partnerlink angeklickt haben. Weitere Informationen zur Datennutzung durch Amazon erhalten Sie in der Datenschutzerklärung des Unternehmens: https://amzn.to/2on1gB6\n\nImpressum: https://www.youtube.com/user/MaxHifiKanal/about"
U3xLOo-CNwo,17.14.11,12 Weird Ways To Sneak Food Into Class / Back To School Pranks,Troom Troom,26,2017-11-12T15:00:05.000Z,sneak food|"how to sneak food into class"|"class hacks"|"school food"|"food in class"|"sneak food into class"|"how to sneak food into school"|"take food to school"|"weird school supplies"|"school pranks"|"back to school"|"hide food"|"eating in class"|"ways to sneak food into class"|"how to sneak food in class"|"how to sneak food in school"|"best school pranks"|"back to school pranks"|"prank"|"school",3153224,28451,2285,3312,https://i.ytimg.com/vi/U3xLOo-CNwo/default.jpg,FALSE,FALSE,FALSE,"Subscribe Here: http://bit.ly/2uaz0on\n12 Hot Glue Gun Life Hacks For Crafting: https://youtu.be/RVrUIQAFldU?list=PLy0LaulZe0vSljAapkasaxsIKJp7I-7j0\nIn this video we will continue the theme of weird ways to sneak food into class! We've invented new ways of how to cheat the teacher. There should be no more boredom and hunger in the class!\n\nSupplies and Tools:\n• Candies and cookies\n• Pencil sharpener\n• Notepaper holder\n• Color and scrapbook paper\n• Ruler\n• Craft knife\n• Ziploc bags\n• Felt\n• Marker\n• Hole puncher\n• Ribbon\n• Donut images\n• Hot glue gun\n• Empty school supply containers\n• Wipes \n• Scissors\n• Fanta\n• Funnel\n• Air dry clay\n• Acrylic paint\n• Sponge\n• Stationery holders\n• Jam\n• Pen\n• Tic-Tac \n\nMusic:\nBest Future House Mix 2017 Vol. 1 by Uroš is licensed under a Creative Commons 3.0 Unported License.\nSource: https://soundcloud.com/urosfuturehouse/best-future-house-mix-2017-vol-1  \n\nWatch More Troom Troom: \nPopular Videos:\n18 Funny Pranks! Prank Wars! https://youtu.be/yWazGzCNtJ4\n11 DIY Edible Makeup Ideas/11 Funny Pranks https://youtu.be/kewz3hF63Xo\n14 Weird Ways To Sneak Food Into Class / Back To School Pranks https://youtu.be/W5p2ndS34vA\nDIY Slime Stress Ball— 5 Ideas https://youtu.be/3VH6KeJn-XA\n11 DIY Edible School Supplies / Pranks For Back To School! https://youtu.be/ZMnz2hfmubs\n\nPopular Playlists:\nFunny Pranks: https://www.youtube.com/playlist?list...\nBack to School: https://www.youtube.com/playlist?list...\nLife Hacks: https://www.youtube.com/playlist?list...\nDIY Cosmetics: https://www.youtube.com/playlist?list...\nAwesome Slimes: https://www.youtube.com/playlist?list...\n\nFollow Troom Troom:\nSubscribe: http://bit.ly/2uaz0on\nInstagram: http://bit.ly/2t0BsOK\nFacebook: http://bit.ly/2uf2qTb\nPinterest: http://bit.ly/2tFz9iT\n\nTroom Troom Español: \nSubscribe: http://bit.ly/2uaqyFo\n\nTroom Troom Française:\nSubscribe: http://bit.ly/2vnYmfc\n\nTroom Troom Russian: \nSubscribe: http://bit.ly/2tEWWiQ\n\nTroom Troom Deutsch:\nSubscribe: http://bit.ly/2wo0oOR\n\nTroom Troom Japanese:\nSubscribe: http://bit.ly/2xK2mZv\n\nAbout Troom Troom: \nEasy DIY how to video tutorials. DIY Accessories, Scrapbooking Cards, Home Décor, Make Up Tutorials, Life Hacks, and MUCH more! Make it easy! \n\nFor any business enquires please contact me at: troomtroomdiy@gmail.com\n\nQuestion of the Day: what idea you liked the most? Comment Below!\n\nDon’t forget to turn on notifications, like, & subscribe!"
Wg6a0chf3SI,17.14.11,Wir haben Hunger! - Kinder bitten auf der Straße um Geld | Auf Streife - Berlin | SAT.1 TV,Auf Streife,24,2017-11-12T16:30:00.000Z,Wir haben hunger! Kinder bitten auf der Straße um Geld|"Kinder haben hunger"|"Kinder fragen auf der Straße nach Geld"|"betteln"|"bettelnde Kinder"|"hunger haben"|"nach Essen fragen"|"Auf Streife"|"Auf Streife Berlin"|"Auf Streife – Die Spezialisten"|"Die Spezialisten"|"Auf Streife ganze Folgen"|"Auf Streife Polizisten"|"Reality TV"|"SAT.1"|"TV show"|"TV",112372,2984,83,328,https://i.ytimg.com/vi/Wg6a0chf3SI/default.jpg,FALSE,FALSE,FALSE,"Bei einer Fußstreife treffen zwei Berliner Beamte auf zwei Kinder, die auf der Straße nach Essen und Geld fragen. Anfangs trauen diese sich nicht zu sagen, wieso sie in dieser Situation sind. Doch dann löst sich die ganze Situation auf.\n\n►Alle Fälle von Auf Streife im Abo!\nhttp://bit.ly/AufStreifeAbonnieren\n\n►Klinik am Südring auf YouTube\nhttp://bit.ly/2zQTqSF\n\n►Die Ruhrpottwache auf YouTube\nhttp://bit.ly/2iKM3Jn\n\n►Ganze Folgen von „Auf Streife“\nhttp://bit.ly/AufStreifeGanzeFolge\n\n►Ganze Folgen von „Auf Streife – Die Spezialisten“\nhttp://bit.ly/AufStreifeDieSpezialistenOnline\n\n►Ganze Folgen von „Auf Streife – Berlin“\nhttp://bit.ly/AufStreifeBerlinOnline\n\n► Auf Streife auf Facebook:\nhttp://bit.ly/AufStreifeFacebook\n\n\nImmer „Auf Streife“ - Der Polizei-Alltag ist hart und oft gefährlich.\nDie Polizisten sind immer im Einsatz: Tag und Nacht, zwischen Touristen und Obdachlosen, in Villenvierteln und Problemkiezen. Auf Basis echter Fälle wird gezeigt, wie ihr Alltag aussieht: mal skurril oder gefährlich, mal amüsant oder emotional - kein Einsatz ist wie der andere! Die Beamten müssen alles geben, um sich und andere zu schützen. \n\n\nMehr Action auf YouTube:\n► taff: https://www.youtube.com/user/taffOffiziell\n► Frühstücksfernsehen: https://www.youtube.com/user/Sat1FFS\n► kabel eins doku: https://www.youtube.com/channel/UCIjfpxlHpcednFfNkDBReBA\n\n\nImpressum:\nhttp://www.studio71.com/impressum/"
